{"schema_version":"1.1","charge":"6-1","status":"GREEN","red_blockers":[],"yellow_warnings":[],"cleaned_facts":{"incident_date":"January 18, 2026","incident_time":"1800 hours","officer_rank":"Officer","officer_name":"T. Davis","officer_post":"housing officer","dorm_area":"E Dorm","officer_activity":"conducting the master roster count","incident_location":"cell E3107","inmate_last_name":"Smith","inmate_first_name":"John","dc_number":"A12345","narrative_reference_style":"he/him","inmate_behavior_before_order":"standing at the cell door outside of his assigned cell","order_type":"verbal","exact_order":"return to his assigned cell","total_orders_given":3,"acknowledgment_type":"eye_contact_and_verbal_response","inmate_quote":"No, I ain't doing that.","inmate_said_nothing":false,"inmate_tone":"loud and argumentative","physical_behavior":"crossed his arms and remained positioned at the cell door","operational_impact":"temporarily interrupting the master roster count and drawing the attention of surrounding inmates","ability_to_comply":"no_issue","ability_to_comply_explanation":null,"force_used":"no","force_explanation":null,"uof_documentation_status":"not_applicable","confinement_status":"placed","additional_facts":null,"oic_rank":"Captain","oic_last_name":"Brown","witness_staff":null,"camera_coverage":null,"separate_conduct_described":false,"separate_conduct_isolatable":null},"narrative":"On January 18, 2026, at approximately 1800 hours, I, Officer T. Davis, was assigned as the housing officer in E Dorm. While conducting the master roster count, I approached cell E3107 and observed Inmate Smith, John DC# A12345, standing at the cell door outside of his assigned cell.\n\nAt this time, I issued a direct verbal order to Inmate Smith to return to his assigned cell. I repeated this directive two additional times, for a total of three verbal orders. Inmate Smith made direct eye contact with this officer. In a loud and argumentative tone, Inmate Smith stated, \"No, I ain't doing that.\" Inmate Smith then crossed his arms and remained positioned at the cell door.\n\nThis conduct disrupted the orderly operation of E Dorm by temporarily interrupting the master roster count and drawing the attention of surrounding inmates.\n\nInmate Smith displayed no apparent medical condition, mental health issue, physical limitation, or language barrier that would have prevented compliance with this officer's directive. No use of force was required.\n\nInmate Smith's conduct is in direct violation of the Florida Department of Corrections Rules of Prohibited Conduct and undermines the lawful authority of correctional staff and the secure and orderly operation of the institution. I then advised Inmate Smith that he would receive a disciplinary report for Section 6-1, Disobeying verbal or written order — any order given to an inmate or inmates by a staff member or other authorized person.\n\nInmate Smith was placed in administrative confinement pending the outcome of this disciplinary report. The shift Officer in Charge, Captain Brown, was notified and authorized the initiation of this report.","flagged_sections":[],"ai_disclosure":"This narrative was formatted with AI assistance using LOCKUPHQ DR Writer v1.1, Charge 6-1. All factual content was provided by the reporting officer. The officer has reviewed and certified the accuracy of this report.","officer_review_checklist":["The inmate's name and DC number are correct and match the inmate involved in this incident.","The incident date and time are accurate.","The location is the exact location where the incident occurred.","The order you gave is documented exactly as you gave it.","The order count is the exact number of orders you gave — not approximate.","If the inmate spoke, the quote inside quotation marks is accurate to what was actually said.","The physical behavior described matches what you directly observed.","The OIC rank and name are correct and this officer did specifically authorize this report.","The confinement status accurately reflects what occurred after the incident.","No facts appear in this report that you did not provide.","You have read the entire narrative and are satisfied it accurately represents your firsthand account.","You understand that by certifying this report you are attesting to the accuracy of its contents."]}